{
  "$schema": "https://json-schema.org/draft/2020-12/schema",
  "$id": "https://github.com/jaredzimmerman/digitaltwins/scen/schemas/scene.schema.json",
  "title": ".scen scene.json",
  "type": "object",
  "required": [
    "id",
    "display_name",
    "kind"
  ],
  "properties": {
    "id": {
      "type": "string",
      "pattern": "^urn:uuid:[0-9a-fA-F]{8}-[0-9a-fA-F]{4}-[0-9a-fA-F]{4}-[0-9a-fA-F]{4}-[0-9a-fA-F]{12}$"
    },
    "display_name": {
      "type": "string",
      "minLength": 1
    },
    "description": {
      "type": "string"
    },
    "aliases": {
      "type": "array",
      "items": {
        "type": "string"
      }
    },
    "links": {
      "type": "array",
      "items": {
        "type": "object",
        "required": [
          "href"
        ]
      }
    },
    "rights": {
      "type": "object",
      "properties": {
        "holder": {
          "type": "string"
        },
        "license": {
          "type": "string"
        }
      },
      "additionalProperties": true
    },
    "consent": {
      "type": "object",
      "properties": {
        "vendors": {
          "type": "array",
          "items": {
            "type": "string"
          }
        },
        "cloud_families": {
          "type": "array",
          "items": {
            "type": "string"
          }
        }
      },
      "additionalProperties": true
    },
    "kind": {
      "enum": [
        "real-place",
        "fictional-place"
      ]
    },
    "location": {
      "type": "object",
      "required": [
        "precision"
      ],
      "properties": {
        "precision": {
          "enum": [
            "none",
            "region",
            "city",
            "exact"
          ]
        },
        "label": {
          "type": "string"
        },
        "lat": {
          "type": "number"
        },
        "lon": {
          "type": "number"
        }
      },
      "additionalProperties": true
    }
  },
  "additionalProperties": true
}
