{"aliases":[],"consent":{"exact_location":false,"vendors":["example-vendor"]},"description":"A narrow galley kitchen with a window over the sink.","display_name":"North Pier kitchen","id":"urn:uuid:5a1e0000-0000-4000-8000-0000000000b1","kind":"real-place","links":[],"location":{"lat":37.8,"lon":-122.4,"precision":"city"},"rights":{"holder":"Example Owner","license":"LicenseRef-example-location"}}