{"aliases":[],"description":"A stylised harbour quay for an animated series.","display_name":"Harbor set, stage 2","id":"urn:uuid:5a1e0000-0000-4000-8000-0000000000b2","kind":"fictional-place","links":[],"location":{"precision":"none"},"rights":{"holder":"Example Studio","license":"LicenseRef-example-set"}}